{
  "$defs": {
    "ConfidenceBand": {
      "enum": [
        "high",
        "medium",
        "low",
        "none"
      ],
      "title": "ConfidenceBand",
      "type": "string"
    },
    "ReviewAction": {
      "enum": [
        "undecided",
        "accept_selected",
        "select_candidate",
        "reject",
        "defer"
      ],
      "title": "ReviewAction",
      "type": "string"
    },
    "SuggestionDisposition": {
      "enum": [
        "suggested",
        "review_required",
        "ambiguous",
        "no_match",
        "manual"
      ],
      "title": "SuggestionDisposition",
      "type": "string"
    },
    "SuggestionReviewDecision": {
      "additionalProperties": false,
      "properties": {
        "action": {
          "$ref": "#/$defs/ReviewAction"
        },
        "candidate_paths": {
          "default": [],
          "items": {
            "type": "string"
          },
          "title": "Candidate Paths",
          "type": "array"
        },
        "confidence_band": {
          "anyOf": [
            {
              "$ref": "#/$defs/ConfidenceBand"
            },
            {
              "type": "null"
            }
          ],
          "default": null
        },
        "context": {
          "anyOf": [
            {
              "type": "string"
            },
            {
              "type": "null"
            }
          ],
          "default": null,
          "title": "Context"
        },
        "disposition": {
          "anyOf": [
            {
              "$ref": "#/$defs/SuggestionDisposition"
            },
            {
              "type": "null"
            }
          ],
          "default": null
        },
        "reason": {
          "title": "Reason",
          "type": "string"
        },
        "selected_source_path": {
          "anyOf": [
            {
              "type": "string"
            },
            {
              "type": "null"
            }
          ],
          "default": null,
          "title": "Selected Source Path"
        },
        "source_path": {
          "anyOf": [
            {
              "type": "string"
            },
            {
              "type": "null"
            }
          ],
          "default": null,
          "title": "Source Path"
        },
        "target_path": {
          "title": "Target Path",
          "type": "string"
        }
      },
      "required": [
        "target_path",
        "action",
        "reason"
      ],
      "title": "SuggestionReviewDecision",
      "type": "object"
    }
  },
  "$schema": "https://json-schema.org/draft/2020-12/schema",
  "additionalProperties": false,
  "properties": {
    "decisions": {
      "items": {
        "$ref": "#/$defs/SuggestionReviewDecision"
      },
      "title": "Decisions",
      "type": "array"
    },
    "mapping_id": {
      "title": "Mapping Id",
      "type": "string"
    },
    "review_version": {
      "const": "0.1",
      "title": "Review Version",
      "type": "string"
    },
    "suggestion_report_sha256": {
      "title": "Suggestion Report Sha256",
      "type": "string"
    }
  },
  "required": [
    "review_version",
    "suggestion_report_sha256",
    "mapping_id",
    "decisions"
  ],
  "title": "SuggestionReviewDocument",
  "type": "object"
}
