{"decisions":[{"action":"select_candidate","candidate_paths":[],"confidence_band":null,"context":null,"disposition":null,"reason":"Apply the independently frozen gold correspondence.","selected_source_path":null,"source_path":"/cdtr_iban","target_path":"/beneficiaryAccountIban"},{"action":"select_candidate","candidate_paths":[],"confidence_band":null,"context":null,"disposition":null,"reason":"Apply the independently frozen gold correspondence.","selected_source_path":null,"source_path":"/cdtr_nm","target_path":"/beneficiaryName"},{"action":"reject","candidate_paths":[],"confidence_band":null,"context":null,"disposition":null,"reason":"Frozen gold declares that no source counterpart exists.","selected_source_path":null,"source_path":null,"target_path":"/chargeBearer"},{"action":"reject","candidate_paths":[],"confidence_band":null,"context":null,"disposition":null,"reason":"Frozen gold declares that no source counterpart exists.","selected_source_path":null,"source_path":null,"target_path":"/chargesAmount"},{"action":"reject","candidate_paths":[],"confidence_band":null,"context":null,"disposition":null,"reason":"Frozen gold declares that no source counterpart exists.","selected_source_path":null,"source_path":null,"target_path":"/exchangeRate"},{"action":"accept_selected","candidate_paths":[],"confidence_band":null,"context":null,"disposition":null,"reason":"Apply the independently frozen gold correspondence.","selected_source_path":null,"source_path":null,"target_path":"/instructedAmount"},{"action":"accept_selected","candidate_paths":[],"confidence_band":null,"context":null,"disposition":null,"reason":"Apply the independently frozen gold correspondence.","selected_source_path":null,"source_path":null,"target_path":"/instructedCurrency"},{"action":"reject","candidate_paths":[],"confidence_band":null,"context":null,"disposition":null,"reason":"Frozen gold declares that no source counterpart exists.","selected_source_path":null,"source_path":null,"target_path":"/intermediaryBic"},{"action":"select_candidate","candidate_paths":[],"confidence_band":null,"context":null,"disposition":null,"reason":"Apply the independently frozen gold correspondence.","selected_source_path":null,"source_path":"/msg_ref","target_path":"/messageIdentifier"},{"action":"select_candidate","candidate_paths":[],"confidence_band":null,"context":null,"disposition":null,"reason":"Apply the independently frozen gold correspondence.","selected_source_path":null,"source_path":"/dbtr_iban","target_path":"/payerAccountIban"},{"action":"select_candidate","candidate_paths":[],"confidence_band":null,"context":null,"disposition":null,"reason":"Apply the independently frozen gold correspondence.","selected_source_path":null,"source_path":"/dbtr_nm","target_path":"/payerName"},{"action":"select_candidate","candidate_paths":[],"confidence_band":null,"context":null,"disposition":null,"reason":"Apply the independently frozen gold correspondence.","selected_source_path":null,"source_path":"/e2e_ref","target_path":"/paymentReference"},{"action":"select_candidate","candidate_paths":[],"confidence_band":null,"context":null,"disposition":null,"reason":"Apply the independently frozen gold correspondence.","selected_source_path":null,"source_path":"/sttlm_dt","target_path":"/processingDate"},{"action":"reject","candidate_paths":[],"confidence_band":null,"context":null,"disposition":null,"reason":"Frozen gold declares that no source counterpart exists.","selected_source_path":null,"source_path":null,"target_path":"/remittanceText"},{"action":"select_candidate","candidate_paths":[],"confidence_band":null,"context":null,"disposition":null,"reason":"Apply the independently frozen gold correspondence.","selected_source_path":null,"source_path":"/sttlm_dt","target_path":"/settlementDate"}],"mapping_id":"blind-payments-credit-transfer-mapping-v1","review_version":"0.1","suggestion_report_sha256":"0887fbf8a7eaf81597e894ed6fb610ca770ebe029f01599c211aa9a9cc749f38"}
