{"decisions":[{"action":"reject","candidate_paths":[],"confidence_band":null,"context":null,"disposition":null,"reason":"Frozen gold declares that no source counterpart exists.","selected_source_path":null,"source_path":null,"target_path":"/accuracyMeters"},{"action":"reject","candidate_paths":[],"confidence_band":null,"context":null,"disposition":null,"reason":"Frozen gold declares that no source counterpart exists.","selected_source_path":null,"source_path":null,"target_path":"/administrativeRegion"},{"action":"reject","candidate_paths":[],"confidence_band":null,"context":null,"disposition":null,"reason":"Frozen gold declares that no source counterpart exists.","selected_source_path":null,"source_path":null,"target_path":"/altitudeDatum"},{"action":"select_candidate","candidate_paths":[],"confidence_band":null,"context":null,"disposition":null,"reason":"Apply the independently frozen gold correspondence.","selected_source_path":null,"source_path":"/collection_ref","target_path":"/collectionIdentifier"},{"action":"accept_selected","candidate_paths":[],"confidence_band":null,"context":null,"disposition":null,"reason":"Apply the independently frozen gold correspondence.","selected_source_path":null,"source_path":null,"target_path":"/coordinateReferenceSystem"},{"action":"select_candidate","candidate_paths":[],"confidence_band":null,"context":null,"disposition":null,"reason":"Apply the independently frozen gold correspondence.","selected_source_path":null,"source_path":"/elev_m","target_path":"/elevationMeters"},{"action":"select_candidate","candidate_paths":[],"confidence_band":null,"context":null,"disposition":null,"reason":"Apply the independently frozen gold correspondence.","selected_source_path":null,"source_path":"/ext_ref","target_path":"/externalIdentifier"},{"action":"accept_selected","candidate_paths":[],"confidence_band":null,"context":null,"disposition":null,"reason":"Apply the independently frozen gold correspondence.","selected_source_path":null,"source_path":null,"target_path":"/featureCategory"},{"action":"select_candidate","candidate_paths":[],"confidence_band":null,"context":null,"disposition":null,"reason":"Apply the independently frozen gold correspondence.","selected_source_path":null,"source_path":"/fid","target_path":"/featureIdentifier"},{"action":"reject","candidate_paths":[],"confidence_band":null,"context":null,"disposition":null,"reason":"Frozen gold declares that no source counterpart exists.","selected_source_path":null,"source_path":null,"target_path":"/geometryType"},{"action":"select_candidate","candidate_paths":[],"confidence_band":null,"context":null,"disposition":null,"reason":"Apply the independently frozen gold correspondence.","selected_source_path":null,"source_path":"/lat_dd","target_path":"/latitude"},{"action":"select_candidate","candidate_paths":[],"confidence_band":null,"context":null,"disposition":null,"reason":"Apply the independently frozen gold correspondence.","selected_source_path":null,"source_path":"/lon_dd","target_path":"/longitude"},{"action":"select_candidate","candidate_paths":[],"confidence_band":null,"context":null,"disposition":null,"reason":"Apply the independently frozen gold correspondence.","selected_source_path":null,"source_path":"/valid_from","target_path":"/observationTime"},{"action":"reject","candidate_paths":[],"confidence_band":null,"context":null,"disposition":null,"reason":"Frozen gold declares that no source counterpart exists.","selected_source_path":null,"source_path":null,"target_path":"/ownerOrganization"},{"action":"accept_selected","candidate_paths":[],"confidence_band":null,"context":null,"disposition":null,"reason":"Apply the independently frozen gold correspondence.","selected_source_path":null,"source_path":null,"target_path":"/validFrom"}],"mapping_id":"blind-geospatial-feature-mapping-v1","review_version":"0.1","suggestion_report_sha256":"957d05dc1785fe47ab135cbfcc71a28bedc86eeaefc40cbffc878dd6d351208c"}
