{"decisions":[{"action":"select_candidate","candidate_paths":[],"confidence_band":null,"context":null,"disposition":null,"reason":"Apply the independently frozen gold correspondence.","selected_source_path":null,"source_path":"/svc_nm","target_path":"/applicationService"},{"action":"reject","candidate_paths":[],"confidence_band":null,"context":null,"disposition":null,"reason":"Frozen gold declares that no source counterpart exists.","selected_source_path":null,"source_path":null,"target_path":"/deploymentEnvironment"},{"action":"select_candidate","candidate_paths":[],"confidence_band":null,"context":null,"disposition":null,"reason":"Apply the independently frozen gold correspondence.","selected_source_path":null,"source_path":"/err_type","target_path":"/failureType"},{"action":"accept_selected","candidate_paths":[],"confidence_band":null,"context":null,"disposition":null,"reason":"Apply the independently frozen gold correspondence.","selected_source_path":null,"source_path":null,"target_path":"/latencyMilliseconds"},{"action":"select_candidate","candidate_paths":[],"confidence_band":null,"context":null,"disposition":null,"reason":"Apply the independently frozen gold correspondence.","selected_source_path":null,"source_path":"/server_addr","target_path":"/remoteEndpoint"},{"action":"reject","candidate_paths":[],"confidence_band":null,"context":null,"disposition":null,"reason":"Frozen gold declares that no source counterpart exists.","selected_source_path":null,"source_path":null,"target_path":"/requestBodyBytes"},{"action":"select_candidate","candidate_paths":[],"confidence_band":null,"context":null,"disposition":null,"reason":"Apply the independently frozen gold correspondence.","selected_source_path":null,"source_path":"/http_mthd","target_path":"/requestMethod"},{"action":"select_candidate","candidate_paths":[],"confidence_band":null,"context":null,"disposition":null,"reason":"Apply the independently frozen gold correspondence.","selected_source_path":null,"source_path":"/url_full","target_path":"/requestUrl"},{"action":"reject","candidate_paths":[],"confidence_band":null,"context":null,"disposition":null,"reason":"Frozen gold declares that no source counterpart exists.","selected_source_path":null,"source_path":null,"target_path":"/responseBodyBytes"},{"action":"accept_selected","candidate_paths":[],"confidence_band":null,"context":null,"disposition":null,"reason":"Apply the independently frozen gold correspondence.","selected_source_path":null,"source_path":null,"target_path":"/responseStatus"},{"action":"reject","candidate_paths":[],"confidence_band":null,"context":null,"disposition":null,"reason":"Frozen gold declares that no source counterpart exists.","selected_source_path":null,"source_path":null,"target_path":"/retryCount"},{"action":"accept_selected","candidate_paths":[],"confidence_band":null,"context":null,"disposition":null,"reason":"Apply the independently frozen gold correspondence.","selected_source_path":null,"source_path":null,"target_path":"/serverHost"},{"action":"select_candidate","candidate_paths":[],"confidence_band":null,"context":null,"disposition":null,"reason":"Apply the independently frozen gold correspondence.","selected_source_path":null,"source_path":"/span_uid","target_path":"/spanIdentifier"},{"action":"select_candidate","candidate_paths":[],"confidence_band":null,"context":null,"disposition":null,"reason":"Apply the independently frozen gold correspondence.","selected_source_path":null,"source_path":"/trace_uid","target_path":"/traceIdentifier"},{"action":"reject","candidate_paths":[],"confidence_band":null,"context":null,"disposition":null,"reason":"Frozen gold declares that no source counterpart exists.","selected_source_path":null,"source_path":null,"target_path":"/userAgent"}],"mapping_id":"blind-observability-http-mapping-v1","review_version":"0.1","suggestion_report_sha256":"cf17b1a870a024668694d038c77b82b3b8089d67531cb818a64d85935c07ecca"}
