{"decisions":[{"action":"reject","candidate_paths":[],"confidence_band":null,"context":null,"disposition":null,"reason":"Frozen gold declares that no source counterpart exists.","selected_source_path":null,"source_path":null,"target_path":"/bodySiteCode"},{"action":"select_candidate","candidate_paths":[],"confidence_band":null,"context":null,"disposition":null,"reason":"Apply the independently frozen gold correspondence.","selected_source_path":null,"source_path":"/clin_eff_ts","target_path":"/clinicallyEffectiveAt"},{"action":"reject","candidate_paths":[],"confidence_band":null,"context":null,"disposition":null,"reason":"Frozen gold declares that no source counterpart exists.","selected_source_path":null,"source_path":null,"target_path":"/deviceIdentifier"},{"action":"select_candidate","candidate_paths":[],"confidence_band":null,"context":null,"disposition":null,"reason":"Apply the independently frozen gold correspondence.","selected_source_path":null,"source_path":"/enc_ref","target_path":"/encounterReference"},{"action":"reject","candidate_paths":[],"confidence_band":null,"context":null,"disposition":null,"reason":"Frozen gold declares that no source counterpart exists.","selected_source_path":null,"source_path":null,"target_path":"/interpretationCode"},{"action":"accept_selected","candidate_paths":[],"confidence_band":null,"context":null,"disposition":null,"reason":"Apply the independently frozen gold correspondence.","selected_source_path":null,"source_path":null,"target_path":"/isFinal"},{"action":"accept_selected","candidate_paths":[],"confidence_band":null,"context":null,"disposition":null,"reason":"Apply the independently frozen gold correspondence.","selected_source_path":null,"source_path":null,"target_path":"/measurementCode"},{"action":"select_candidate","candidate_paths":[],"confidence_band":null,"context":null,"disposition":null,"reason":"Apply the independently frozen gold correspondence.","selected_source_path":null,"source_path":"/ucum_cd","target_path":"/measurementUnit"},{"action":"select_candidate","candidate_paths":[],"confidence_band":null,"context":null,"disposition":null,"reason":"Apply the independently frozen gold correspondence.","selected_source_path":null,"source_path":"/result_num","target_path":"/numericResult"},{"action":"accept_selected","candidate_paths":[],"confidence_band":null,"context":null,"disposition":null,"reason":"Apply the independently frozen gold correspondence.","selected_source_path":null,"source_path":null,"target_path":"/observationIdentifier"},{"action":"select_candidate","candidate_paths":[],"confidence_band":null,"context":null,"disposition":null,"reason":"Apply the independently frozen gold correspondence.","selected_source_path":null,"source_path":"/clin_eff_ts","target_path":"/recordedAt"},{"action":"reject","candidate_paths":[],"confidence_band":null,"context":null,"disposition":null,"reason":"Frozen gold declares that no source counterpart exists.","selected_source_path":null,"source_path":null,"target_path":"/referenceRangeHigh"},{"action":"select_candidate","candidate_paths":[],"confidence_band":null,"context":null,"disposition":null,"reason":"Apply the independently frozen gold correspondence.","selected_source_path":null,"source_path":"/performer_ref","target_path":"/responsibleParty"},{"action":"reject","candidate_paths":[],"confidence_band":null,"context":null,"disposition":null,"reason":"Frozen gold declares that no source counterpart exists.","selected_source_path":null,"source_path":null,"target_path":"/specimenIdentifier"},{"action":"select_candidate","candidate_paths":[],"confidence_band":null,"context":null,"disposition":null,"reason":"Apply the independently frozen gold correspondence.","selected_source_path":null,"source_path":"/pt_ref","target_path":"/subjectReference"}],"mapping_id":"blind-healthcare-observation-mapping-v1","review_version":"0.1","suggestion_report_sha256":"d6c6251415793f1c96b164ec9bd9b7988934816bf9226cf4e3cc0fc603f67c19"}
