{"decisions":[{"action":"reject","candidate_paths":[],"confidence_band":null,"context":null,"disposition":null,"reason":"Frozen gold declares that no source counterpart exists.","selected_source_path":null,"source_path":null,"target_path":"/billingAmount"},{"action":"reject","candidate_paths":[],"confidence_band":null,"context":null,"disposition":null,"reason":"Frozen gold declares that no source counterpart exists.","selected_source_path":null,"source_path":null,"target_path":"/carbonIntensity"},{"action":"accept_selected","candidate_paths":[],"confidence_band":null,"context":null,"disposition":null,"reason":"Apply the independently frozen gold correspondence.","selected_source_path":null,"source_path":null,"target_path":"/consumptionValue"},{"action":"reject","candidate_paths":[],"confidence_band":null,"context":null,"disposition":null,"reason":"Frozen gold declares that no source counterpart exists.","selected_source_path":null,"source_path":null,"target_path":"/demandMaximum"},{"action":"accept_selected","candidate_paths":[],"confidence_band":null,"context":null,"disposition":null,"reason":"Apply the independently frozen gold correspondence.","selected_source_path":null,"source_path":null,"target_path":"/intervalDurationSeconds"},{"action":"select_candidate","candidate_paths":[],"confidence_band":null,"context":null,"disposition":null,"reason":"Apply the independently frozen gold correspondence.","selected_source_path":null,"source_path":"/period_start","target_path":"/intervalStart"},{"action":"accept_selected","candidate_paths":[],"confidence_band":null,"context":null,"disposition":null,"reason":"Apply the independently frozen gold correspondence.","selected_source_path":null,"source_path":null,"target_path":"/measurementUnit"},{"action":"accept_selected","candidate_paths":[],"confidence_band":null,"context":null,"disposition":null,"reason":"Apply the independently frozen gold correspondence.","selected_source_path":null,"source_path":null,"target_path":"/meterIdentifier"},{"action":"reject","candidate_paths":[],"confidence_band":null,"context":null,"disposition":null,"reason":"Frozen gold declares that no source counterpart exists.","selected_source_path":null,"source_path":null,"target_path":"/outageFlag"},{"action":"accept_selected","candidate_paths":[],"confidence_band":null,"context":null,"disposition":null,"reason":"Apply the independently frozen gold correspondence.","selected_source_path":null,"source_path":null,"target_path":"/publicationTimestamp"},{"action":"select_candidate","candidate_paths":[],"confidence_band":null,"context":null,"disposition":null,"reason":"Apply the independently frozen gold correspondence.","selected_source_path":null,"source_path":"/quality_cd","target_path":"/qualityFlag"},{"action":"select_candidate","candidate_paths":[],"confidence_band":null,"context":null,"disposition":null,"reason":"Apply the independently frozen gold correspondence.","selected_source_path":null,"source_path":"/period_start","target_path":"/readingTimestamp"},{"action":"select_candidate","candidate_paths":[],"confidence_band":null,"context":null,"disposition":null,"reason":"Apply the independently frozen gold correspondence.","selected_source_path":null,"source_path":"/commodity_cd","target_path":"/resourceKind"},{"action":"select_candidate","candidate_paths":[],"confidence_band":null,"context":null,"disposition":null,"reason":"Apply the independently frozen gold correspondence.","selected_source_path":null,"source_path":"/usage_pt","target_path":"/servicePointIdentifier"},{"action":"reject","candidate_paths":[],"confidence_band":null,"context":null,"disposition":null,"reason":"Frozen gold declares that no source counterpart exists.","selected_source_path":null,"source_path":null,"target_path":"/tariffCode"}],"mapping_id":"blind-energy-interval-mapping-v1","review_version":"0.1","suggestion_report_sha256":"d296c85a88a844c408cee958947f57120c539f6fd2fd60dab268604d6e9a57e5"}
